{
  "title": "NVIDIA 독주 종식: 하이퍼스케일 ASIC으로 자본이동, '그림자 승자'가 돈을 번다",
  "thesis": "하이퍼스케일러들이 'Nvidia tax'를 피해 맞춤형 AI ASIC 스택을 구축하면서 설계·IP 업체, 인터커넥트 제공자, 전력·냉각 공급자 및 고급 패키저·파운드리 같은 '그림자 승자'가 구조적이고 반복적인 가치를 확보할 것이다.",
  "lead": "Amazon의 Trainium3 공개는 단순한 제품 발표를 넘어 NVIDIA 단독 지배의 균열을 알리는 신호로 볼 수 있다; 추론 수요의 급증, 컴파일러·이식성 개선, 하이퍼스케일러의 규모 경제와 TCO 압박이 맞물리며 범용 GPU에서 목적 설계 ASIC로의 전환을 촉진하고, 그 결과 실제 경제적 보상은 하이퍼스케일러가 아닌 설계/IP·인터커넥트·전력·패키징 등 공급망 핵심업체로 이동할 가능성이 높다 — 다만 이 결론은 배포 규모와 패키징·파운드리·표준 채택 타이밍에 의존하므로 확신 수준은 중간이다.",
  "report_body": "NVIDIA의 H100·Blackwell 계열이 AI 인프라 투자 판도를 규정해 온 것은 사실이지만, 최근 하이퍼스케일러들의 맞춤형 ASIC 개발 선언은 단순한 경쟁 구도 변화가 아니라 구조적 전환의 시작을 시사한다. 범용 GPU는 훈련과 추론을 모두 잘 수행하지만, 반복적이고 대규모인 추론 워크로드에서는 단위당 비용과 전력 효율 면에서 한계가 명확하며, 이를 'Nvidia tax'로 표현할 수 있다. 이 비용 구조가 하이퍼스케일러에게 중대한 TCO 압박으로 작용하면서 목적 설계 ASIC로의 전환 경제성이 빠르게 개선되고 있다. \n\n기술적·경제적 동인이 맞물리는 '왜 지금'의 이유는 세 가지다. 첫째, 추론 중심 수요의 폭발적 성장으로 동일한 모델을 대량으로 서비스할 경우 ASIC의 단위비용 우위가 커진다. 둘째, 컴파일러와 이식성(모델을 다른 아키텍처로 내보내는 툴체인)의 성숙은 하이퍼스케일러가 GPU 생태계에 묶이는 장벽을 낮춘다. 셋째, 하이퍼스케일러의 대규모 CAPEX 사이클(예: 2025–2026년 예상)과 구체적 프로그램(예: Project Rainier)이 등장하면서 ASIC 도입의 시급성이 현실화되고 있다. 이들 요인은 단일 원인이 아니라 함께 작동해 GPU 중심의 가치사슬을 분해하고 있다. \n\n중요한 점은 하이퍼스케일러의 '구조적 독립'이 곧 완전한 내재화(vertically integrated everything)를 의미하지 않는다는 사실이다. 오히려 ASIC 배포는 설계·물리 설계·IP 라이선스, 고속 인터커넥트(리타이머, CXL, AEC), 광모듈·광소자, PMIC·48V 전력 아키텍처, 액체냉각·열관리 솔루션, 그리고 CoWoS·2.5D 등 고급 패키징과 파운드리 용량 같은 전문 공급자의 역할을 핵심으로 재정렬한다. 이들 공급자는 칩 자체의 '전선과 블루프린트'를 제공하거나, 패키지·전력·연결을 책임지며 하이퍼스케일 프로그램이 규모를 키울수록 반복적·예측 가능한 매출을 얻는다. \n\n구체적 수혜 그룹은 네 가지 축으로 요약된다. 첫째, ASIC 설계·IP 제공자(예: Broadcom, Marvell, Alchip, Rambus, Synopsys, Cadence)는 칩당 높은 콘텐츠와 NRE 수익을 확보한다. 둘째, 인터커넥트·광·신호무결성 회사(예: Astera Labs, Credo, Coherent, Lumentum, Ayar Labs)는 CXL, 고속 SerDes, 광연결이 확산될수록 시스템당 부품 수요와 단가 우위를 갖는다. 셋째, 전력·열관리 업체(예: Monolithic Power Systems, Vicor, Vertiv, nVent)는 PMIC, 48V 아키텍처, 액체냉각 등으로 지속적 수요를 창출한다. 넷째, 파운드리·고급 패키징(예: TSMC, Amkor, Ibiden, Unimicron)은 공정·패키징 병목이자 높은 수익성을 가진 단계로서 모든 ASIC 배포의 전제조건이다. \n\nProject Rainier(대규모 Trainium 배포)는 이러한 기계적 연결고리를 보여주는 실증적 사례다. AWS가 Trainium 기반 서버를 대량으로 표준화하면 Alchip 같은 턴키 물리설계·패키징 파트너는 칩당·서버당 반복 매출을 얻고, Astera·Credo 같은 인터커넥트 업체는 리타이머·AEC·CXL 컨트롤러 수요가 늘며, TSMC·OSAT은 웨이퍼·CoWoS 수요 증가로 용량이 곧 매출로 연결된다. 동시에 MPS·Vicor·Vertiv 등 전력·냉각 공급자는 랙당 전력밀도 상승으로 모듈·시스템 판매가 반복 발생한다. 이처럼 '하이퍼스케일 프로그램 → 특정 공급자 수익'의 인과 고리는 명확하다. \n\n투자 관점에서의 실무적 함의는 프론트라인 가속기(하이퍼스케일러 자체 또는 GPU 벤더)만을 쫓는 포지셔닝을 재검토하라는 것이다. 포트폴리오 가중치는 설계·IP 및 EDA 툴, 인터커넥트·광 부문, 전력·열관리, 고급 패키징·파운드리에 옮겨야 한다. 실무적으로는 다음의 버킷으로 운용하는 것이 적절하다: \n- Core (안정적 플랫폼 노출): TSMC, Synopsys/Cadence, 큰 IP·패키지 노출을 가진 설계자들. \n- Growth/Alpha (고베타·계약 민감): Astera Labs, Alchip, Credo, MPS, Vicor—하이퍼스케일러 프로그램에 직접 연결된 수혜자들. \n- Watchlist (기술·시기 리스크 관찰): Ayar Labs(실리콘 포토닉스), 광소자 벤더들, OSAT 대체 솔루션들. \n\n이 전략은 다음 리스크와 검증 과제를 동반한다. 핵심 리스크로는 고객 집중(특정 공급자가 AWS에 과다 노출), 지정학적·공급망 취약성(대만·파운드리·기판), 하이퍼스케일러의 이중 소싱 정책에 따른 가격·볼륨 제한, 패키징·CoWoS 병목으로 인한 공급 지연, 실험적 기술(CXL·실리콘 포토닉스) 채택 지연 등이 있다. 투자자들은 다음 항목을 우선 검증해야 한다: 하이퍼스케일러의 실제 계약·볼륨 약정(예: Alchip·Astera의 구체적 수주), 패키징·파운드리의 가용성과 타임라인, CXL·광연결 채택의 표준화 속도 및 컴파일러·포팅 도구의 실무적 성숙도. \n\n결론적으로, 하이퍼스케일러의 ASIC 전환은 단순히 가속기 생태계의 재편을 넘어 자본의 흐름을 공급망 핵심업체로 재배치하는 사건이다. 투자자는 '병사는 아닌 청사진을 사라(buy the blueprint, not the soldier)'는 원칙하에 설계·인터커넥트·전력·패키징 공급자에 대한 비중을 늘리고, 고객 집중·공급 병목·표준 채택 리스크를 엄격히 검증하며 포지션을 운용해야 한다.",
  "key_points": [
    "하이퍼스케일러의 목적 설계 ASIC 도입은 추론 중심 워크로드의 TCO 우위를 통해 실물 수요를 창출하며, 그 이익은 하이퍼스케일러가 아니라 공급망의 전문업체로 이동한다.",
    "설계·IP·EDA, 고속 인터커넥트·광모듈, PMIC·48V·액체냉각 같은 전력·열관리, 그리고 CoWoS·ABF 기판을 제공하는 파운드리·OSAT이 반복적·구조적 매출을 얻는다.",
    "Project Rainier와 같은 대규모 배포는 공급자별로 기계적 매출 흐름을 만들어 포트폴리오의 고(高)베타 이름과 플랫폼형 수익원을 동시에 노출시킨다.",
    "투자전략은 프론트라인 가속기 쫓기에서 벗어나 '블루프린트·전선'을 소유한 기업으로 회전해야 하며, 이는 리스크(고객 집중·공정 병목·기술 채택) 관리와 병행되어야 한다."
  ],
  "risk_note": "핵심 불확실성은 하이퍼스케일러의 배포 규모와 시점, 패키징·파운드리 용량의 가용성, 그리고 CXL·광연결 같은 인터페이스 표준의 채택 속도다; 또한 일부 수혜자는 특정 고객 의존도가 높아 계약 누락이나 이중 소싱이 발생하면 수익 가시성이 크게 훼손된다.",
  "deck": [
    {
      "title": "변곡점: Trainium3는 판 바꾸기 신호",
      "content": "Trainium3는 단순 제품 발표를 넘어 하이퍼스케일러의 GPU 의존 탈피 신호로 해석할 수 있다."
    },
    {
      "title": "왜 ASIC인가(경제·기술)",
      "content": "대규모 반복 추론 워크로드에서 ASIC은 단위비용과 전력 효율 면에서 GPU보다 유리하다."
    },
    {
      "title": "누가 돈을 버는가: 그림자 승자",
      "content": "설계·IP, 인터커넥트, 전력·열관리, 고급 패키징·파운드리가 구조적 수혜를 본다."
    },
    {
      "title": "케이스 스터디: Project Rainier의 수익 연결",
      "content": "AWS의 Trainium 대규모 표준화는 Alchip·Astera·TSMC·MPS 등에 기계적 매출을 창출한다."
    },
    {
      "title": "투자전략: 블루프린트를 사라",
      "content": "프론트라인 가속기보다 설계·연결·에너지·제조 인프라 공급자 비중을 확대하라."
    },
    {
      "title": "검증 포인트 & 리스크",
      "content": "고객 계약, 패키징·파운드리 타임라인, CXL·광 채택 속도를 우선 확인하라."
    }
  ],
  "confidence": {
    "level": "medium",
    "summary": "논리적 인과관계와 사례(예: Project Rainier)로 주장이 잘 조직되어 있으나, 정량적 계약·볼륨 데이터와 표준 채택 타이밍 등 핵심 근거가 제한적이어서 결론의 시점과 규모에는 불확실성이 있다."
  }
}
